{
  "$schema": "http://json-schema.org/draft-07/schema#",
  "$id": "https://github.com/openwallet-foundation/credential-format-comparison-sig/schemas/Key-Management.json",
  "type": "object",
  "additionalProperties": false,
  "properties": {
    "$schema": {
      "type": "string",
      "description": "JSON Schema URI"
    },
    "Key Management": {
      "type": "string",
      "description": "Glossary"
    },
    "Implementation Support (e.g. Libraries) / Active Community": {
      "type": "string",
      "description": "How complex is the implementation? Which/How many useful software libraries available?"
    },
    "IPR Policy": {
      "type": "string",
      "description": "What is the policy regarding intellectual properties associated with this technology?"
    },
    "Specification": {
      "type": "string",
      "description": "Where is the key management specified?"
    },
    "Infrastructure for Key Resolution": {
      "allOf": [
        {
          "$ref": "defs.json#/definitions/Filter"
        },
        {
          "description": "Is there any infrastructure required to resolve keys and/or validate identifier to key binding"
        }
      ]
    },
    "Key Rotation": {
      "allOf": [
        {
          "$ref": "defs.json#/definitions/Filter"
        },
        {
          "description": "Can the key referred to in a credential be replaced by another key?"
        }
      ]
    },
    "Key History": {
      "allOf": [
        {
          "$ref": "defs.json#/definitions/Filter"
        },
        {
          "description": "Is it possible to retain and obtain the history of keys related to a certain identifier?"
        }
      ]
    },
    "Party": {
      "type": "array",
      "items": {
        "enum": ["issuer", "holder"]
      },
      "description": "What party may uses this technique?"
    }
  },
  "required": ["$schema", "Key Management"],
  "title": "KeyManagement"
}
