{
  "$schema": "./schema.json",
  "Key Management": "KERI",
  "Implementation Support (e.g. Libraries) / Active Community": "https://weboftrust.github.io/did-keri/",
  "Infrastructure for Key Resolution": {
    "Value": true,
    "Description": "witness network"
  },
  "Key Rotation": true,
  "Key History": true,
  "Party": ["holder", "issuer"]
}
