{
  "$schema": "./schema.json",
  "Key Management": "did:keri",
  "Implementation Support (e.g. Libraries) / Active Community": "https://weboftrust.github.io/did-keri/",
  "Infrastructure for Key Resolution": "witness network",
  "Key Rotation": true,
  "Key History": true,
  "Party": ["holder", "issuer"]
}
