{
  "$schema": "./schema.json",
  "Key Management": "did:key",
  "Implementation Support (e.g. Libraries) / Active Community": "https://w3c-ccg.github.io/did-method-key/",
  "Infrastructure for Key Resolution": "none",
  "Key Rotation": false,
  "Key History": false,
  "Party": ["holder", "issuer"]
}
