{
  "$schema": "../../viewer/src/schemas/Key-Management.json",
  "Key Management": "did:web",
  "Implementation Support (e.g. Libraries) / Active Community": "https://github.com/w3c-ccg/did-method-web",
  "Infrastructure for Key Resolution": {
    "Value": true,
    "Description": "web server"
  },
  "Key Rotation": true,
  "Key History": false,
  "Party": ["holder", "issuer"]
}
